{
  "$schema": "https://json-schema.org/draft/2020-12/schema",
  "$id": "https://github.com/Arnie016/prompt-vault/schemas/prompt-entry.schema.json",
  "title": "Prompt Entry",
  "type": "object",
  "additionalProperties": false,
  "required": [
    "id",
    "slug",
    "title",
    "category",
    "status",
    "source",
    "created_at",
    "raw_prompt",
    "cleaned_prompt",
    "tags",
    "style_tokens",
    "reuse_patterns",
    "variations",
    "why_it_works",
    "failure_modes",
    "best_for"
  ],
  "properties": {
    "id": {
      "type": "string",
      "minLength": 1
    },
    "slug": {
      "type": "string",
      "pattern": "^[a-z0-9-]+$"
    },
    "title": {
      "type": "string",
      "minLength": 1
    },
    "category": {
      "type": "string",
      "minLength": 1
    },
    "status": {
      "type": "string",
      "enum": [
        "seed",
        "curated",
        "tested",
        "experimental"
      ]
    },
    "source": {
      "type": "string",
      "minLength": 1
    },
    "created_at": {
      "type": "string",
      "format": "date"
    },
    "raw_prompt": {
      "type": "string",
      "minLength": 1
    },
    "cleaned_prompt": {
      "type": "string",
      "minLength": 1
    },
    "tags": {
      "type": "array",
      "minItems": 1,
      "items": {
        "type": "string",
        "minLength": 1
      }
    },
    "style_tokens": {
      "type": "array",
      "minItems": 1,
      "items": {
        "type": "string",
        "minLength": 1
      }
    },
    "reuse_patterns": {
      "type": "array",
      "minItems": 1,
      "items": {
        "type": "string",
        "minLength": 1
      }
    },
    "variations": {
      "type": "array",
      "minItems": 1,
      "items": {
        "type": "string",
        "minLength": 1
      }
    },
    "why_it_works": {
      "type": "array",
      "minItems": 1,
      "items": {
        "type": "string",
        "minLength": 1
      }
    },
    "failure_modes": {
      "type": "array",
      "items": {
        "type": "string",
        "minLength": 1
      }
    },
    "best_for": {
      "type": "array",
      "minItems": 1,
      "items": {
        "type": "string",
        "minLength": 1
      }
    },
    "notes": {
      "type": "string"
    }
  }
}
